{
  "artifact_type": "gpt_handoff.artifact.manifest",
  "artifact_version": "0.2.0",
  "packet_id": "pkt-operationalize-chatgpt-pipeline-001",
  "workflow_state": "DEFINITION_UNDER_REVIEW",
  "review_state": "DEFINITION_UNDER_REVIEW",
  "required_artifacts": [
    {
      "ref": "generated/packets/pkt-operationalize-chatgpt-pipeline-001/machine/packet.definition.json",
      "kind": "packet_definition"
    },
    {
      "ref": "generated/packets/pkt-operationalize-chatgpt-pipeline-001/machine/scm.pattern.binding.json",
      "kind": "scm_pattern_binding"
    },
    {
      "ref": "generated/packets/pkt-operationalize-chatgpt-pipeline-001/machine/packet.review.request.json",
      "kind": "packet_review_request"
    },
    {
      "ref": "generated/packets/pkt-operationalize-chatgpt-pipeline-001/machine/root.trust.evidence.json",
      "kind": "root_trust_evidence"
    },
    {
      "ref": "generated/packets/pkt-operationalize-chatgpt-pipeline-001/machine/regen.record.json",
      "kind": "regen_record"
    },
    {
      "ref": "generated/packets/pkt-operationalize-chatgpt-pipeline-001/machine/artifact.manifest.json",
      "kind": "artifact_manifest"
    },
    {
      "ref": "generated/packets/pkt-operationalize-chatgpt-pipeline-001/machine/packet.approval.json",
      "kind": "compatibility_placeholder",
      "transitional": true,
      "authoritative": false
    },
    {
      "ref": "generated/packets/pkt-operationalize-chatgpt-pipeline-001/human/packet.definition.md",
      "kind": "derived_human_definition"
    }
  ],
  "conditional_artifacts": [
    {
      "ref": "generated/packets/pkt-operationalize-chatgpt-pipeline-001/machine/packet.review.decision.json",
      "kind": "packet_review_decision",
      "required_when": "human_review_decision_issued == true"
    }
  ],
  "supporting_inputs": [
    "generated/problem_sets/ps-operationalize-chatgpt-pipeline-001/problem_set.json",
    "generated/schemas/chatgpt-pipeline/workflow/problem_set.schema.json",
    "generated/schemas/chatgpt-pipeline/workflow/chatgpt.packet.pipeline.manifest.json"
  ]
}
